{
  "schema_version": "1.0.0",
  "task_id": "yurikuchumov-ux/ai-operating-system#52",
  "repository": "yurikuchumov-ux/ai-operating-system",
  "issue_number": 52,
  "objective": "Correct retry governance from clean main using Issue #52 findings on candidate af3f1d8a77e103632bdac7d65f10b07121f9764d. Make TaskState BLOCKED an owner-gated resumable pause; DONE, CANCELLED and REJECTED remain terminal. Permit BLOCKED-to-ACTIVE only through a new immutable task revision that binds new material evidence to an authenticated repository owner event. Chat alone is insufficient; an authenticated Issue owner event may be referenced by the immutable task. Keep max_attempts at three or less per revision; conceptual fourth-or-later continuation starts a new bounded revision and retains aggregate history. The owner may retain or replace the executor. Preserve independent verification/review, exact-SHA review, human merge and no self-approval. Change only the execution plan; do not change code, workflows, schemas, tests, credentials or billing paths.",
  "change_policy": {
    "change_required": true,
    "policy_exception_id": null,
    "no_change": {
      "allowed": false,
      "reason_codes": [],
      "required_evidence_types": []
    }
  },
  "base_ref": "main",
  "base_sha": "9cd102ced47fa1ba5f2d844e43acf5ce7ec3e718",
  "branch": "agent/issue-52-retry-governance-v2",
  "allowed_paths": [
    "docs/AI_DEVELOPMENT_STUDIO_EXECUTION_PLAN.md"
  ],
  "denied_paths": [
    ".ai/tasks/**",
    ".github/**",
    "contracts/**",
    "fixtures/**",
    "requirements-*.txt",
    "tests/**",
    "tools/**",
    "src/**",
    "AI_OS.md",
    "README.md",
    "CHANGELOG.md"
  ],
  "risk_class": "L2",
  "executor": {
    "adapter": "human-supervised-claude-code",
    "version": "claude-code-oauth-actions-issue-52-retry-governance-v2-owner-authorized",
    "max_attempts": 1,
    "timeout_seconds": 900
  },
  "acceptance_criteria": [
    {
      "id": "AC-RETRY-GOVERNANCE-1",
      "predicate_id": "process.exit_code.equals",
      "parameters": {
        "component": "retry-governance-plan-update",
        "value": 0,
        "trusted_evidence_source": "coordinator_observed_process_exit_code",
        "forbidden_sources": [
          "executor_self_report",
          "actions_job_conclusion"
        ]
      },
      "required": true,
      "linked_checks": [
        "retry-governance-regression-tests"
      ]
    }
  ],
  "required_checks": [
    {
      "id": "retry-governance-regression-tests",
      "command_id": "repo.contracts.b3.tests",
      "required": true,
      "expected_postconditions": [
        {
          "predicate_id": "process.exit_code.equals",
          "parameters": {
            "value": 0
          }
        }
      ]
    }
  ],
  "review_policy": {
    "reviewer_class": "independent-engineering",
    "policy_id": "review-independence.v1",
    "forbidden_lineage_overlaps": [
      "agent_runtime_id",
      "credential_principal",
      "authored_commits"
    ],
    "minimum_distinct_human_operators": 1
  },
  "external_side_effects": "owner_approved",
  "created_by": "github:yurikuchumov-ux/codex-control-plane",
  "created_at": "2026-07-17T18:41:42Z"
}
