{
  "schema_version": "1.0.0",
  "task_id": "yurikuchumov-ux/ai-operating-system#51",
  "repository": "yurikuchumov-ux/ai-operating-system",
  "issue_number": 51,
  "objective": "Build Issue 51 registry from clean main. Exactly roles governance/template/voice, owner yurikuchumov-ux, names ai-operating-system, ai-development-studio-template, -ai-development-studio, SHAs a36a8eefcdd06c56edeec93057a90c58a239cf22, ec088bf2e95e048ce1f5b69d969542b516afbc8b, f6550d4078ffccc952db269081619fdfe57e598c. Copy exact labels, visibility, boundary from section 3.1; derive full_name and GitHub URL. Schema: exactly 3 entries, unique role/name/full_name/url. Validator loads fixed registry/schema/plan; requires one exact 3.1 five-column table, 3 rows, one link and all values equal. Deterministic JSON for I/O, Unicode, JSON, schema, semantic failures. Full-validator missing/extra count mutations must assert earliest schema_validation_failed; test invalid_repository_count only by direct semantic layer if retained. Never accept arbitrary failure. Cover entry/table/link/header/order mutations. No prose scan or added section. Claude Pro OAuth only; no API billing.",
  "change_policy": {
    "change_required": true,
    "policy_exception_id": null,
    "no_change": {
      "allowed": false,
      "reason_codes": [],
      "required_evidence_types": []
    }
  },
  "base_ref": "main",
  "base_sha": "e81cec593e7387cbf4aa6cc1f89b00b9cb82b008",
  "branch": "agent/issue-51-canonical-repository-registry-v9",
  "allowed_paths": [
    "contracts/canonical-repositories.v1.json",
    "contracts/schemas/canonical-repositories.v1.schema.json",
    "tools/validate_canonical_repositories.py",
    "tests/test_b3_canonical_repository_registry.py",
    "docs/AI_DEVELOPMENT_STUDIO_EXECUTION_PLAN.md"
  ],
  "denied_paths": [
    ".ai/tasks/**",
    ".github/**",
    "AI_OS.md",
    "README.md",
    "CHANGELOG.md",
    "fixtures/**",
    "requirements-*.txt",
    "standards/**",
    "templates/**",
    "tests/test_b0_contracts.py",
    "tests/test_b1_finalizer.py",
    "tests/test_b2_verifier.py",
    "tests/test_b3_canonical_repository_names.py",
    "tests/test_b3_p0_actions_adapter.py",
    "tests/test_b3_terminal_propagation.py",
    "tools/p0_actions_adapter.py",
    "tools/validate_b0.py",
    "tools/verify_b2.py"
  ],
  "risk_class": "L2",
  "executor": {
    "adapter": "human-supervised-claude-code",
    "version": "claude-code-oauth-actions-issue-51-registry-v9-owner-authorized",
    "max_attempts": 1,
    "timeout_seconds": 1800
  },
  "acceptance_criteria": [
    {
      "id": "AC-CANONICAL-REGISTRY-1",
      "predicate_id": "process.exit_code.equals",
      "parameters": {
        "component": "issue-51-canonical-repository-registry-suite",
        "value": 0,
        "trusted_evidence_source": "coordinator_observed_process_exit_code",
        "forbidden_sources": [
          "executor_self_report",
          "actions_job_conclusion"
        ]
      },
      "required": true,
      "linked_checks": [
        "issue-51-canonical-registry-tests"
      ]
    }
  ],
  "required_checks": [
    {
      "id": "issue-51-canonical-registry-tests",
      "command_id": "repo.contracts.b3.tests",
      "required": true,
      "expected_postconditions": [
        {
          "predicate_id": "process.exit_code.equals",
          "parameters": {
            "value": 0
          }
        }
      ]
    }
  ],
  "review_policy": {
    "reviewer_class": "independent-engineering",
    "policy_id": "review-independence.v1",
    "forbidden_lineage_overlaps": [
      "agent_runtime_id",
      "credential_principal",
      "authored_commits"
    ],
    "minimum_distinct_human_operators": 1
  },
  "external_side_effects": "owner_approved",
  "created_by": "github:yurikuchumov-ux/codex-control-plane",
  "created_at": "2026-07-18T11:07:02Z"
}
