{
  "schema_version": "1.0.0",
  "task_id": "yurikuchumov-ux/ai-operating-system#51",
  "repository": "yurikuchumov-ux/ai-operating-system",
  "issue_number": 51,
  "objective": "Replace Issue 50 free-form Markdown heuristics with one structured canonical repository registry. Add a versioned JSON registry, its JSON schema, a fail-closed validator, deterministic B3 unittest coverage, and exact registry-to-execution-plan inventory validation. The registry must contain only yurikuchumov-ux/ai-operating-system, yurikuchumov-ux/ai-development-studio-template, and yurikuchumov-ux/-ai-development-studio with unique stable roles, names, full names and URLs. Reject unknown, missing, extra, duplicate, substituted or malformed registry entries and inventory rows. Treat arbitrary prose outside the governed inventory as non-authoritative. Use a new Claude Code Pro OAuth runtime, not the Issue 50 session, with no API credential or metered fallback. Do not change workflow, command registry, requirements, fixtures, product code, deployment, task contracts, other tests or any path outside the five allowed files.",
  "change_policy": {
    "change_required": true,
    "policy_exception_id": null,
    "no_change": {
      "allowed": false,
      "reason_codes": [],
      "required_evidence_types": []
    }
  },
  "base_ref": "main",
  "base_sha": "9cd102ced47fa1ba5f2d844e43acf5ce7ec3e718",
  "branch": "agent/issue-51-canonical-repository-registry",
  "allowed_paths": [
    "contracts/canonical-repositories.v1.json",
    "contracts/schemas/canonical-repositories.v1.schema.json",
    "tools/validate_canonical_repositories.py",
    "tests/test_b3_canonical_repository_registry.py",
    "docs/AI_DEVELOPMENT_STUDIO_EXECUTION_PLAN.md"
  ],
  "denied_paths": [
    ".ai/tasks/**",
    ".github/**",
    "AI_OS.md",
    "README.md",
    "CHANGELOG.md",
    "fixtures/**",
    "requirements-*.txt",
    "standards/**",
    "templates/**",
    "tests/test_b0_contracts.py",
    "tests/test_b1_finalizer.py",
    "tests/test_b2_verifier.py",
    "tests/test_b3_canonical_repository_names.py",
    "tests/test_b3_p0_actions_adapter.py",
    "tests/test_b3_terminal_propagation.py",
    "tools/p0_actions_adapter.py",
    "tools/validate_b0.py",
    "tools/verify_b2.py"
  ],
  "risk_class": "L2",
  "executor": {
    "adapter": "human-supervised-claude-code",
    "version": "claude-code-oauth-new-runtime-issue-51-registry-v1",
    "max_attempts": 3,
    "timeout_seconds": 1800
  },
  "acceptance_criteria": [
    {
      "id": "AC-CANONICAL-REGISTRY-1",
      "predicate_id": "process.exit_code.equals",
      "parameters": {
        "component": "issue-51-canonical-repository-registry-suite",
        "value": 0,
        "trusted_evidence_source": "coordinator_observed_process_exit_code",
        "forbidden_sources": [
          "executor_self_report",
          "actions_job_conclusion"
        ]
      },
      "required": true,
      "linked_checks": [
        "issue-51-canonical-registry-tests"
      ]
    }
  ],
  "required_checks": [
    {
      "id": "issue-51-canonical-registry-tests",
      "command_id": "repo.contracts.b3.tests",
      "required": true,
      "expected_postconditions": [
        {
          "predicate_id": "process.exit_code.equals",
          "parameters": {
            "value": 0
          }
        }
      ]
    }
  ],
  "review_policy": {
    "reviewer_class": "independent-engineering",
    "policy_id": "review-independence.v1",
    "forbidden_lineage_overlaps": [
      "agent_runtime_id",
      "credential_principal",
      "authored_commits"
    ],
    "minimum_distinct_human_operators": 1
  },
  "external_side_effects": "owner_approved",
  "created_by": "github:yurikuchumov-ux/codex-control-plane",
  "created_at": "2026-07-17T13:58:00Z"
}
