{
  "schema_version": "1.0.0",
  "task_id": "yurikuchumov-ux/ai-operating-system#47",
  "repository": "yurikuchumov-ux/ai-operating-system",
  "issue_number": 47,
  "objective": "Prove the merged Claude Actions subscription OAuth path with one bounded, useful documentation change. In docs/AI_DEVELOPMENT_STUDIO_EXECUTION_PLAN.md, add one concise repository-backed policy note stating that Claude Actions defaults to CLAUDE_CODE_OAUTH_TOKEN and that ANTHROPIC_API_KEY, Bedrock, Vertex, Foundry, or any other metered-provider fallback requires a separate explicit Product Owner approval recorded before dispatch. Preserve the existing document structure and claims. Do not claim that billing counters, tests, workflow verification, publication, review, or merge succeeded; the workflow and owner verify those independently. Do not edit workflow, adapter, tests, task contracts, schemas, fixtures, product behavior, deployment, readiness, or any path outside the single allowed document.",
  "change_policy": {
    "change_required": true,
    "policy_exception_id": null,
    "no_change": {
      "allowed": false,
      "reason_codes": [],
      "required_evidence_types": []
    }
  },
  "base_ref": "main",
  "base_sha": "fe0caf33695e34e0084802d000d10e59322bf72d",
  "branch": "agent/issue-47-claude-oauth-canary",
  "allowed_paths": [
    "docs/AI_DEVELOPMENT_STUDIO_EXECUTION_PLAN.md"
  ],
  "denied_paths": [
    ".ai/tasks/**",
    ".github/**",
    "AI_OS.md",
    "README.md",
    "CHANGELOG.md",
    "contracts/**",
    "fixtures/**",
    "requirements-*.txt",
    "standards/**",
    "templates/**",
    "tools/**",
    "tests/**"
  ],
  "risk_class": "L2",
  "executor": {
    "adapter": "human-supervised-claude-code",
    "version": "claude-code-action-6902c227-issue-47-oauth-canary-v1",
    "max_attempts": 3,
    "timeout_seconds": 1800
  },
  "acceptance_criteria": [
    {
      "id": "AC-CLAUDE-OAUTH-CANARY-1",
      "predicate_id": "process.exit_code.equals",
      "parameters": {
        "component": "issue-47-claude-oauth-canary-suite",
        "value": 0,
        "trusted_evidence_source": "workflow_controlled_process_exit_code",
        "forbidden_sources": [
          "executor_self_report",
          "actions_job_conclusion"
        ]
      },
      "required": true,
      "linked_checks": [
        "issue-47-claude-oauth-canary-tests"
      ]
    }
  ],
  "required_checks": [
    {
      "id": "issue-47-claude-oauth-canary-tests",
      "command_id": "repo.contracts.b3.tests",
      "required": true,
      "expected_postconditions": [
        {
          "predicate_id": "process.exit_code.equals",
          "parameters": {
            "value": 0
          }
        }
      ]
    }
  ],
  "review_policy": {
    "reviewer_class": "independent-engineering",
    "policy_id": "review-independence.v1",
    "forbidden_lineage_overlaps": [
      "agent_runtime_id",
      "credential_principal",
      "authored_commits"
    ],
    "minimum_distinct_human_operators": 1
  },
  "external_side_effects": "owner_approved",
  "created_by": "github:yurikuchumov-ux/codex-control-plane",
  "created_at": "2026-07-17T11:39:20Z"
}
