{
  "schema_version": "1.0.0",
  "task_id": "yurikuchumov-ux/ai-operating-system#68",
  "repository": "yurikuchumov-ux/ai-operating-system",
  "issue_number": 68,
  "objective": "Make P0 Actions Adapter self-updates truthful by using verifier and control code snapshotted from the exact immutable protected-default base for executor postconditions, publisher verification, trusted-signal assembly and finalization, while candidate registered commands still run against the candidate checkout.",
  "change_policy": {
    "change_required": true,
    "policy_exception_id": null,
    "no_change": {
      "allowed": false,
      "reason_codes": [],
      "required_evidence_types": []
    }
  },
  "base_ref": "main",
  "base_sha": "d4f10b714de3afae84d48dfcd3daa6405092a973",
  "branch": "agent/issue-68-immutable-verifier-bootstrap",
  "allowed_paths": [
    ".github/workflows/p0-actions-adapter.yml",
    "tests/test_b3_p0_actions_adapter.py"
  ],
  "denied_paths": [
    ".ai/**",
    "AI_OS.md",
    "README.md",
    "CHANGELOG.md",
    "contracts/**",
    "docs/**",
    "fixtures/**",
    "requirements-*.txt",
    "standards/**",
    "templates/**",
    "tools/**",
    "tests/test_b0_contracts.py",
    "tests/test_b3_canonical_repository_contract.py",
    "tests/test_b3_canonical_repository_plan.py",
    "tests/test_b3_canonical_repository_registry.py",
    "tests/test_b3_canonical_repository_cli.py",
    "tests/test_b3_terminal_propagation.py",
    ".github/workflows/b3-terminal-propagation.yml"
  ],
  "risk_class": "L2",
  "executor": {
    "adapter": "human-supervised-claude-code",
    "version": "claude-code-2.1.197-p0-immutable-verifier-bootstrap",
    "max_attempts": 3,
    "timeout_seconds": 1800
  },
  "acceptance_criteria": [
    {
      "id": "AC-P0-IMMUTABLE-VERIFIER-BOOTSTRAP",
      "predicate_id": "process.exit_code.equals",
      "parameters": {
        "component": "p0-actions-adapter-immutable-control-plane",
        "value": 0,
        "trusted_evidence_source": "workflow_observed_process_exit_code",
        "forbidden_sources": [
          "executor_self_report",
          "actions_job_conclusion",
          "pull_request_body",
          "review_comment_prose"
        ],
        "specification": {
          "problem_evidence": {
            "parent_issue": 67,
            "failed_run_id": "29934251987",
            "failed_reason": "control_integrity_failed",
            "cause": "a legitimately changed workspace verifier module was both compared with its immutable base hash and eligible to be imported by its own verification path"
          },
          "immutable_control_snapshot": {
            "source": "exact protected-default base checkout admitted by base SHA",
            "created_before_executor_edits": true,
            "created_before_subject_checkout": true,
            "adapter_bytes_copied_outside_workspace": true,
            "admission_observed_sha256_binding_required": true,
            "read_only_or_equivalent_tamper_evident_state_required": true,
            "missing_unreadable_symlinked_substituted_or_modified_snapshot_fails_closed": true
          },
          "trusted_import_policy": {
            "execute_postconditions_use_only_base_snapshot": true,
            "publisher_reverification_uses_only_base_snapshot": true,
            "finalizer_input_validation_and_signal_assembly_use_only_base_snapshot": true,
            "finalizer_document_generation_uses_only_base_snapshot": true,
            "workspace_or_subject_module_shadowing_forbidden": true,
            "module_loaded_by_exact_file_path": true,
            "trusted_module_identity_checked_before_each_security_boundary": true
          },
          "candidate_behavior": {
            "registered_required_command_runs_on_candidate_checkout": true,
            "candidate_tests_import_candidate_code": true,
            "candidate_diff_scope_recomputed_by_trusted_base_module": true,
            "candidate_adapter_may_change_without_automatic_control_integrity_failure": true,
            "candidate_adapter_cannot_influence_its_own_verifier_decision": true
          },
          "regressions": {
            "deterministic_subject_self_approval_mutation_rejected": true,
            "deterministic_snapshot_hash_tamper_rejected": true,
            "deterministic_snapshot_path_substitution_rejected": true,
            "deterministic_workspace_shadowing_rejected": true,
            "ordinary_non_adapter_execute_behavior_unchanged": true,
            "verify_only_evidence_binding_unchanged": true,
            "publisher_actor_separation_unchanged": true,
            "required_check_real_exit_code_and_timeout_unchanged": true,
            "failure_result_and_check_run_always_published": true
          },
          "security": {
            "permissions_least_privilege": true,
            "author_jobs_no_write_credentials": true,
            "verifier_only_checks_write": true,
            "shell_injection_from_dispatch_inputs_forbidden": true,
            "mutable_refs_forbidden": true,
            "artifact_replay_forbidden": true,
            "model_api_secret_use_forbidden": true,
            "branch_protection_change_forbidden": true,
            "default_branch_write_and_merge_forbidden": true
          },
          "postconditions": {
            "changed_paths_equal_allowed_paths": true,
            "git_diff_check": true,
            "task_specific_tests": true,
            "b3_suite": true,
            "full_repository_suite": true,
            "workflow_yaml_parse": true,
            "targeted_mutation_checks": true,
            "real_actions_execute_run_id_required": true,
            "fresh_independent_exact_sha_chatgpt_pro_maximum_review": true,
            "draft_pr_only": true
          }
        }
      },
      "required": true,
      "linked_checks": [
        "issue-68-p0-immutable-verifier-bootstrap-tests"
      ]
    }
  ],
  "required_checks": [
    {
      "id": "issue-68-p0-immutable-verifier-bootstrap-tests",
      "command_id": "repo.contracts.b3.tests",
      "required": true,
      "expected_postconditions": [
        {
          "predicate_id": "process.exit_code.equals",
          "parameters": {
            "value": 0
          }
        }
      ]
    }
  ],
  "review_policy": {
    "reviewer_class": "independent-engineering",
    "policy_id": "review-independence.v1",
    "forbidden_lineage_overlaps": [
      "agent_runtime_id",
      "credential_principal",
      "authored_commits"
    ],
    "minimum_distinct_human_operators": 1
  },
  "external_side_effects": "owner_approved",
  "created_by": "github:yurykuchumov-ux/codex-control-plane",
  "created_at": "2026-07-22T15:45:53Z"
}
